{"$schema":"https://json-schema.org/draft/2020-12/schema","$id":"https://conductor.local/schemas/install-manifest.schema.json","title":"Conductor install manifest","type":"object","required":["schemaVersion","installedVersion","installedAt","source","files"],"properties":{"schemaVersion":{"const":1},"installedVersion":{"type":"string","pattern":"^\\d+\\.\\d+\\.\\d+$"},"installedAt":{"type":"string"},"source":{"type":"string"},"files":{"type":"array","items":{"type":"object","required":["path","sha256"],"properties":{"path":{"type":"string"},"sha256":{"type":"string","pattern":"^[a-f0-9]{64}$"}}}}},"additionalProperties":false}
